{"$schema":"https://json-schema.org/draft/2020-12/schema","canonicalization":"recursive-key-sort/contract-array-sort/compact-utf8/no-newline","diagnostics":[],"provenance":{"evidence_authority":{"blob_oid":"f16375097eefdfb7c3a3ecc46a5a725c6f48f619","digest":"sha256:d1cda76dce2a3862e2481d5f2f77801e966a22461e70ca83c961d71fa6aaf23a","revision":"895ece437b28055dc5ba189bcddfadc3b188df70","schema_version":"functional-parity-capability-runtime-evidence/v2"},"intent_authority":{"blob_oid":"cb7f445acd715a697fb04e91fcb14393163a728c","digest":"sha256:53e6303506293296dbfae2c318fab9e557de576298f9812644686ee7df09d358","revision":"895ece437b28055dc5ba189bcddfadc3b188df70","schema_version":"functional-parity-accepted-intent/v2"},"legacy_catalog_sha256":"sha256:be01a954ebc417af97d715ddb62e984e0e0610c8a4ac40be752d9b044cf68996","legacy_openapi_sha256":"sha256:58a0373fa6a9361a6fcea7a41030928fbd98f085ee739b5f2d6ff0afd99df1d9","native_catalog_sha256":"sha256:69e8749d3ea926913e0c910f968cfb2bb483f3c8e35c07e561bb2ae6955b5fea","native_openapi_sha256":"sha256:5e6a2fd3d49a24c4f77441f34029cd15ccbbcf6d96074ae8e47162efc80ade2a"},"rows":[{"comparison_ref_id":"intent://composition:receipts:owner-scoped-approval:v1","diagnostics":[{"backend":"legacy_symfony","claim_kind":"persisted_outbox","code":"EFFECT_DECLARATION_MISSING","detail":"No witness satisfies effect effect-owner-approval-decision-audit-persisted.","intent_ref_id":"intent://composition:receipts:owner-scoped-approval:v1"},{"backend":"legacy_symfony","claim_kind":"persisted_outbox","code":"EFFECT_DECLARATION_MISSING","detail":"No witness satisfies effect effect-owner-approval-submission-audit-persisted.","intent_ref_id":"intent://composition:receipts:owner-scoped-approval:v1"},{"backend":"legacy_symfony","claim_kind":null,"code":"RECEIPT_STALE","detail":"The backend-specific v2 receipt has stale provenance.","intent_ref_id":"intent://composition:receipts:owner-scoped-approval:v1"},{"backend":"native_effect","claim_kind":"operation_observed","code":"OPERATION_DRIFT","detail":"Node owner-approval-native_effect-approval-queue-read operation digest is stale.","intent_ref_id":"intent://composition:receipts:owner-scoped-approval:v1"},{"backend":"native_effect","claim_kind":"operation_observed","code":"OPERATION_DRIFT","detail":"Node owner-approval-native_effect-approve operation digest is stale.","intent_ref_id":"intent://composition:receipts:owner-scoped-approval:v1"},{"backend":"native_effect","claim_kind":"operation_observed","code":"OPERATION_DRIFT","detail":"Node owner-approval-native_effect-approver-scope-boundary operation digest is stale.","intent_ref_id":"intent://composition:receipts:owner-scoped-approval:v1"},{"backend":"native_effect","claim_kind":"operation_observed","code":"OPERATION_DRIFT","detail":"Node owner-approval-native_effect-fresh-approval-list operation digest is stale.","intent_ref_id":"intent://composition:receipts:owner-scoped-approval:v1"},{"backend":"native_effect","claim_kind":"operation_observed","code":"OPERATION_DRIFT","detail":"Node owner-approval-native_effect-fresh-owner-list operation digest is stale.","intent_ref_id":"intent://composition:receipts:owner-scoped-approval:v1"},{"backend":"native_effect","claim_kind":"operation_observed","code":"OPERATION_DRIFT","detail":"Node owner-approval-native_effect-not-pending-approval operation digest is stale.","intent_ref_id":"intent://composition:receipts:owner-scoped-approval:v1"},{"backend":"native_effect","claim_kind":"operation_observed","code":"OPERATION_DRIFT","detail":"Node owner-approval-native_effect-owner-read operation digest is stale.","intent_ref_id":"intent://composition:receipts:owner-scoped-approval:v1"},{"backend":"native_effect","claim_kind":"operation_observed","code":"OPERATION_DRIFT","detail":"Node owner-approval-native_effect-owner-session-boundary operation digest is stale.","intent_ref_id":"intent://composition:receipts:owner-scoped-approval:v1"},{"backend":"native_effect","claim_kind":"operation_observed","code":"OPERATION_DRIFT","detail":"Node owner-approval-native_effect-rejection-owner-readback operation digest is stale.","intent_ref_id":"intent://composition:receipts:owner-scoped-approval:v1"},{"backend":"native_effect","claim_kind":"operation_observed","code":"OPERATION_DRIFT","detail":"Node owner-approval-native_effect-submit operation digest is stale.","intent_ref_id":"intent://composition:receipts:owner-scoped-approval:v1"},{"backend":"native_effect","claim_kind":null,"code":"RECEIPT_STALE","detail":"The backend-specific v2 receipt has stale provenance.","intent_ref_id":"intent://composition:receipts:owner-scoped-approval:v1"}],"equivalence":"not_equivalent","intent_ref_ids":["intent://composition:receipts:owner-scoped-approval:v1"],"intent_revision":"owner-approval-claim-evidence-v2","legacy":{"claim":"unsupported","diagnostics":[{"backend":"legacy_symfony","claim_kind":"persisted_outbox","code":"EFFECT_DECLARATION_MISSING","detail":"No witness satisfies effect effect-owner-approval-decision-audit-persisted.","intent_ref_id":"intent://composition:receipts:owner-scoped-approval:v1"},{"backend":"legacy_symfony","claim_kind":"persisted_outbox","code":"EFFECT_DECLARATION_MISSING","detail":"No witness satisfies effect effect-owner-approval-submission-audit-persisted.","intent_ref_id":"intent://composition:receipts:owner-scoped-approval:v1"},{"backend":"legacy_symfony","claim_kind":null,"code":"RECEIPT_STALE","detail":"The backend-specific v2 receipt has stale provenance.","intent_ref_id":"intent://composition:receipts:owner-scoped-approval:v1"}],"evidence_status":"stale","missing_claim_kinds":["authorization_observed","boundary_observation","fresh_read_observed","operation_observed","persistence_observed","rejection_observed"],"witness_digest":"sha256:1af8d529942597c0291d2cea242ed9e6113f68824a805a5ece980f51da68bd27"},"native":{"claim":"unsupported","diagnostics":[{"backend":"native_effect","claim_kind":"operation_observed","code":"OPERATION_DRIFT","detail":"Node owner-approval-native_effect-approval-queue-read operation digest is stale.","intent_ref_id":"intent://composition:receipts:owner-scoped-approval:v1"},{"backend":"native_effect","claim_kind":"operation_observed","code":"OPERATION_DRIFT","detail":"Node owner-approval-native_effect-approve operation digest is stale.","intent_ref_id":"intent://composition:receipts:owner-scoped-approval:v1"},{"backend":"native_effect","claim_kind":"operation_observed","code":"OPERATION_DRIFT","detail":"Node owner-approval-native_effect-approver-scope-boundary operation digest is stale.","intent_ref_id":"intent://composition:receipts:owner-scoped-approval:v1"},{"backend":"native_effect","claim_kind":"operation_observed","code":"OPERATION_DRIFT","detail":"Node owner-approval-native_effect-fresh-approval-list operation digest is stale.","intent_ref_id":"intent://composition:receipts:owner-scoped-approval:v1"},{"backend":"native_effect","claim_kind":"operation_observed","code":"OPERATION_DRIFT","detail":"Node owner-approval-native_effect-fresh-owner-list operation digest is stale.","intent_ref_id":"intent://composition:receipts:owner-scoped-approval:v1"},{"backend":"native_effect","claim_kind":"operation_observed","code":"OPERATION_DRIFT","detail":"Node owner-approval-native_effect-not-pending-approval operation digest is stale.","intent_ref_id":"intent://composition:receipts:owner-scoped-approval:v1"},{"backend":"native_effect","claim_kind":"operation_observed","code":"OPERATION_DRIFT","detail":"Node owner-approval-native_effect-owner-read operation digest is stale.","intent_ref_id":"intent://composition:receipts:owner-scoped-approval:v1"},{"backend":"native_effect","claim_kind":"operation_observed","code":"OPERATION_DRIFT","detail":"Node owner-approval-native_effect-owner-session-boundary operation digest is stale.","intent_ref_id":"intent://composition:receipts:owner-scoped-approval:v1"},{"backend":"native_effect","claim_kind":"operation_observed","code":"OPERATION_DRIFT","detail":"Node owner-approval-native_effect-rejection-owner-readback operation digest is stale.","intent_ref_id":"intent://composition:receipts:owner-scoped-approval:v1"},{"backend":"native_effect","claim_kind":"operation_observed","code":"OPERATION_DRIFT","detail":"Node owner-approval-native_effect-submit operation digest is stale.","intent_ref_id":"intent://composition:receipts:owner-scoped-approval:v1"},{"backend":"native_effect","claim_kind":null,"code":"RECEIPT_STALE","detail":"The backend-specific v2 receipt has stale provenance.","intent_ref_id":"intent://composition:receipts:owner-scoped-approval:v1"}],"evidence_status":"stale","missing_claim_kinds":["authorization_observed","boundary_observation","fresh_read_observed","operation_observed","persistence_observed","rejection_observed"],"witness_digest":"sha256:d265a3b8641250cab28aaba18445a3151c3337a7d14b129b4afc21651788fb8c"}},{"comparison_ref_id":"intent://composition:recruitment:interview-scheduling-invitation-response:v1","diagnostics":[{"backend":"legacy_symfony","claim_kind":"persisted_outbox","code":"EFFECT_DECLARATION_MISSING","detail":"No witness satisfies effect effect-interview-invitation-outbox-persisted.","intent_ref_id":"intent://composition:recruitment:interview-scheduling-invitation-response:v1"},{"backend":"legacy_symfony","claim_kind":"boundary_observation","code":"MISSING_OUTCOME","detail":"No witness satisfies assertion assertion-interview-invitation-rejected.","intent_ref_id":"intent://composition:recruitment:interview-scheduling-invitation-response:v1"},{"backend":"legacy_symfony","claim_kind":"boundary_observation","code":"MISSING_OUTCOME","detail":"No witness satisfies assertion assertion-interview-invitation-scheduled.","intent_ref_id":"intent://composition:recruitment:interview-scheduling-invitation-response:v1"},{"backend":"legacy_symfony","claim_kind":null,"code":"RECEIPT_STALE","detail":"The backend-specific v2 receipt has stale provenance.","intent_ref_id":"intent://composition:recruitment:inte